{
  "$schema": "https://json-schema.org/draft/2020-12/schema",
  "$id": "https://appsec-advisor/schemas/fragments/verdict.schema.json",
  "title": "Management Summary — Verdict fragment",
  "description": "Structured Management Summary verdict. The generator and gate share the concern rating; the LLM authors evidence-supported prose and the composer adds counts and citations.",
  "type": "object",
  "required": ["severity", "opening", "bullets", "closing"],
  "additionalProperties": false,
  "properties": {
    "severity": {
      "type": "string",
      "enum": ["green", "yellow", "red"],
      "description": "Concern level in the assessed scope: red for any Critical priority finding or Critical design risk, otherwise yellow for High, otherwise green. Green means no High or Critical concern reported, never production readiness. Refuted findings are excluded; practice findings retain their unproven status."
    },
    "opening": {
      "type": "string",
      "minLength": 60,
      "maxLength": 450,
      "pattern": "^(?!.*\\b[FTW]-\\d{3,4}\\b).*$",
      "description": "The judgement in one or two short sentences, rendered right after the composer's concern label. First: what the system is (confirmed use case when known) and the worst outcome an attacker reaches. Second: what that means for this use — under which conditions it may run and what must not happen; a declared no-material-harm answer and its assumptions belong here. Standard weakness names are allowed. Do not assert production readiness, deployment safety or complete coverage, and do not generalise beyond the evidence ('every', 'all'). Do not enumerate findings or severity counts, or restate method and coverage; the composer supplies them. No technology identifiers, code, locations or finding IDs."
    },
    "bullets_intro": {
      "type": "string",
      "minLength": 20,
      "maxLength": 200,
      "pattern": "^(?!.*\\b[FTW]-\\d{3,4}\\b).*$",
      "description": "One short neutral introduction without a ranking or shared access prerequisite. Use Security concerns behind this assessment: on red/yellow, Residual risks worth reviewing: on green. Design risks and unproven findings must not be framed as confirmed attacks."
    },
    "bullets": {
      "type": "array",
      "minItems": 1,
      "maxItems": 8,
      "description": "One to eight evidence-supported scenarios or design concerns. Every red/yellow bullet cites a High or Critical priority finding or design risk. Cite design-risk weaknesses directly when no confirmed finding supports the concern; do not invent an attack.",
      "items": {
        "type": "object",
        "required": ["title", "body", "refs"],
        "additionalProperties": false,
        "properties": {
          "title": {
            "type": "string",
            "minLength": 5,
            "maxLength": 60,
            "description": "Short business-outcome or design-concern headline. Standard weakness names are allowed; implementation details are not."
          },
          "body": {
            "type": "string",
            "minLength": 20,
            "maxLength": 260,
            "description": "Exactly one short sentence in PRODUCT-OWNER language: the weakness class in plain words, optionally followed by its standard term in parentheses, then who can reach it and what an attacker achieves. Describe a business or operational consequence, not an exploit recipe. FORBIDDEN here (they belong in §8/§7): technology identifiers, config keys, library names or version pins, CVE/CWE numbers, file names / paths / file:line refs, framework-internal symbols, port numbers, HTTP-header names, protocol names, code snippets, or backticks. GOOD: 'Missing ownership checks (IDOR) let any signed-in customer read and change another customer's records.' BAD: 'routes/order.ts passes req.params.id to findOne() without an ownerId clause (CWE-639).'"
          },
          "refs": {
            "type": "array",
            "minItems": 1,
            "maxItems": 5,
            "items": {
              "type": "string",
              "pattern": "^[FTW]-\\d{3,4}$",
              "description": "Live finding F-NNN/T-NNN or design-risk weakness W-NNN. Every reference must directly support the concern and resolve in the current model. The composer displays compact citations; a W reference does not establish confirmed exploitation."
            }
          }
        }
      }
    },
    "closing": {
      "type": "string",
      "minLength": 40,
      "maxLength": 220,
      "pattern": "^(?!.*\\b[FTW]-\\d{3,4}\\b).*$",
      "description": "ONE short plain-language closing assessment — the bottom line / call to action. Rendered after the bullets blockquote. Do NOT reference F-NNN / T-NNN / W-NNN IDs, security acronyms, attack-class names, config keys, libraries, files, or implementation details."
    }
  }
}
